{
  "type": ["DigitalIdentityAnchor", "VerifiableCredential"],
  "@context": ["https://www.w3.org/ns/credentials/v2", "https://test.uncefact.org/vocabulary/untp/dia/0.2.1/"],
  "id": "did:web:sample-business.com:123456789#90664869327",
  "issuer": {
    "type": ["CredentialIssuer"],
    "id": "did:web:identifiers.example-company.com:12345",
    "name": "Example Company Pty Ltd",
    "otherIdentifier": [
      {
        "type": ["Identifier"],
        "id": "https://id.gs1.org/01/09520123456788/21/12345",
        "name": "EV battery 300Ah.",
        "registeredId": "90664869327",
        "idScheme": {
          "type": ["IdentifierScheme"],
          "id": "https://id.gs1.org/01/",
          "name": "Global Trade Identification Number (GTIN)"
        }
      },
      {
        "type": ["Identifier"],
        "id": "https://id.gs1.org/01/09520123456788/21/12345",
        "name": "EV battery 300Ah.",
        "registeredId": "90664869327",
        "idScheme": {
          "type": ["IdentifierScheme"],
          "id": "https://id.gs1.org/01/",
          "name": "Global Trade Identification Number (GTIN)"
        }
      }
    ]
  },
  "validFrom": "2024-03-15T12:00:00",
  "validUntil": "2034-03-15T12:00:00",
  "credentialSubject": {
    "type": ["RegisteredIdentity", "Identifier"],
    "id": "did:web:samplecompany.com/123456789",
    "name": "Sample business Ltd",
    "registeredId": "123456789",
    "idScheme": {
      "type": ["IdentifierScheme"],
      "id": "https://id.gs1.org/01/",
      "name": "Global Trade Identification Number (GTIN)"
    },
    "registerType": "Business",
    "registrationScopeList": ["https://jargon.sh", "https://jargon.sh"]
  }
}
